{
  "$schema": "../schemas/learn-profile-snapshot.schema.json",
  "profile_id": "p1",
  "version": 3,
  "updated_at": "2026-01-31T06:32:59.604Z",
  "pre_context": {
    "raw": {
      "pre_q1_style": "mixed"
    },
    "parsed": {
      "learning_style": "theoretical"
    },
    "provenance": {
      "template_version": "pre_context_v1.3",
      "captured_at": "2026-01-01T00:00:00.000Z",
      "asked_vs_reused": "asked",
      "gating_reason": "test"
    }
  },
  "skills": {
    "asserted": [],
    "inferred": []
  },
  "_metadata": {
    "schema_version": "1.0.0"
  }
}